{
  "$schema": "https://json-schema.org/draft/2020-12/schema",
  "version": 1,
  "type": "object",
  "required": ["block_id", "kind", "title", "html"],
  "properties": {"block_id": {"type": "string"}, "kind": {"enum": ["title_deck", "introduction", "interlude", "cover_copy"]}, "title": {"type": "string"}, "html": {"type": "string"}}
}
