{
  "block_id": "bridge",
  "kind": "interlude",
  "title": "From the org chart to the buyer's chair",
  "html": "<p>The piece just now asked what actually separates a forward-deployed engineer from a good consultant. This one moves from that question to a different room entirely: the moment a customer decides what they are willing to give up to get what they need. The movement ahead sits on the buyer's side of that decision, not the seller's.</p>"
}
